### ISSUE TITLE
Illegal major version specified: found 252 wanted 192

### ISSUE THREAD

**Issue by jansyren** [MarcJHuber/event-driven-servers#162]
I get this message in the log for the tac_plus-ng server and the clients claim they can't connect with the tacacs server. I did a packet capture (I am running it inside a docker container but that shouldn't make any difference, we do that with the old tac_plus server) and the capture shows that the tacacs server is sending out packets with incorrect checksum. Any idea what I could check or do?

I am just trying to migrate from the old tac_plus to the new and improved tac_plus-ng, so it might have to do with the configuration as well but testing it works and when I do mavistest it works with ldap (AD) backend as well. But from any external access I get this.

**The debug printout:**

```
7: 15:18:58.213 18/00000000: 100.x.x.x connection request from 100.x.x.x (realm: default)
7: 15:18:58.213 0/00000000: - 100.x.x.x: Illegal major version specified: found 49 wanted 192
7: 15:23:19.060 19/00000000: 100.x.x.x connection request from 100.x.x.x (realm: default)
7: 15:23:19.060 0/00000000: - 100.x.x.x: Illegal major version specified: found 252 wanted 192
```

**The log:**

```
2025-05-17 15:18:58 +0000 start	tcp	100.x.x.x	51006	172.y.y.y	49			
2025-05-17 15:18:58 +0000 stop	tcp	100.x.x.x	51006	172.y.y.y	49			
2025-05-17 15:23:19 +0000 start	tcp	100.x.x.x	46996	172.y.y.y	49			
2025-05-17 15:23:19 +0000 stop	tcp	100.x.x.x	46996	172.y.y.y	49
```

**The dump:**

```
root@bf6210ed191c:/# tcpdump -n -vvvvv -i eth0 port 49
tcpdump: listening on eth0, link-type EN10MB (Ethernet), snapshot length 262144 bytes
15:23:19.048748 IP (tos 0x0, ttl 57, id 38435, offset 0, flags [DF], proto TCP (6), length 60)
    100.x.x.x.46996 > 172.y.y.y: Flags [S], cksum 0xa643 (correct), seq 3246180019, win 64240, options [mss 1460,sackOK,TS val 926879590 ecr 0,nop,wscale 7], length 0
15:23:19.048786 IP (tos 0x0, ttl 64, id 0, offset 0, flags [DF], proto TCP (6), length 60)
    172.y.y.y > 100.x.x.x.46996: Flags [S.], cksum 0x205f (incorrect -> 0x6413), seq 1117004367, ack 3246180020, win 65160, options [mss 1460,sackOK,TS val 1689810155 ecr 926879590,nop,wscale 7], length 0
15:23:19.059771 IP (tos 0x0, ttl 57, id 38436, offset 0, flags [DF], proto TCP (6), length 52)
    100.x.x.x.46996 > 172.y.y.y: Flags [.], cksum 0x8f67 (correct), seq 1, ack 1, win 502, options [nop,nop,TS val 926879601 ecr 1689810155], length 0
15:23:19.059855 IP (tos 0x0, ttl 57, id 38437, offset 0, flags [DF], proto TCP (6), length 108)
    100.x.x.x.46996 > 172.y.y.y: Flags [P.], cksum 0x42d3 (correct), seq 1:57, ack 1, win 502, options [nop,nop,TS val 926879601 ecr 1689810155], length 56
15:23:19.059869 IP (tos 0x0, ttl 64, id 2276, offset 0, flags [DF], proto TCP (6), length 52)
    172.y.y.y > 100.x.x.x.46996: Flags [.], cksum 0x2057 (incorrect -> 0x8f1d), seq 1, ack 57, win 509, options [nop,nop,TS val 1689810166 ecr 926879601], length 0
15:23:19.060325 IP (tos 0x0, ttl 64, id 2277, offset 0, flags [DF], proto TCP (6), length 52)
    172.y.y.y > 100.x.x.x.46996: Flags [R.], cksum 0x2057 (incorrect -> 0x8f18), seq 1, ack 57, win 509, options [nop,nop,TS val 1689810167 ecr 926879601], length 0
```

**Comment by MarcJHuber** [comment]
Hi Jan,

thanks a lot for reporting this issue, I was too focused on RADIUS support to notice that one of the RADIUS buffering fixes broke TCP. 3c07dce39d92b07b8424140bf378054f9920b04e moves back to expected behavior.

Thanks,

Marc

**Comment by jansyren** [comment]
Hi,

Works flawlessly, thanks a bunch!
