### ISSUE TITLE
Unable to use custom LDAP attribute

### ISSUE THREAD

**Issue by dgaur25** [MarcJHuber/event-driven-servers#250]
Hi,

I am trying to setup ldap for tac+ng. In our organisation, users are assigned an attribute value which tells what group they are from e.g. employee, students etc. This value is stored in "URTI" attribute. 
I am trying to use this value and allow only "EMP" RTI users to a specific host. This is what I have:

    mavis module = external {
        # LDAP connection settings
        setenv LDAP_HOSTS    = "ldaps://testldapserver.ca"
        setenv LDAP_BASE     = "ou=people,dc=test,dc=ca"
        setenv LDAP_USER     = "cn=userinfo,ou=ldapaccess,dc=test,dc=ca"
        setenv LDAP_PASSWD   = "password1234"
        setenv LDAP_TACMEMBER = "URTI"
        exec = /usr/local/sbin/pammavis pammavis -s tac_plus
    }

I tried to use it in the ruleset like this:

    rule eip {
        script {
            if (host == EIP) {
                if (member == "EMP") {
                    permit 
                }
            }
        }
    }

It is looking at the users file for the "EMP" group. I am not sure how I can use the LDAP_TACMEMBER attribute in rulesets. Could you please help me with it? Thanks!

**Comment by MarcJHuber** [comment]
Hi,

not sure what you're trying here, but `pammavis` clearly doesn't recognize LDAP_* environment variables. First thing you should do is to actually use a LDAP backend.

Cheers,

Marc

**Comment by dgaur25** [comment]
Apologies, I changed from pam to ldap so had it misconfigured. This is how it looks like:

mavis module = external {
    setenv LDAP_HOSTS    = "ldaps://testldapserver.ca"
    setenv LDAP_BASE     = "ou=people,dc=test,dc=ca"
    setenv LDAP_USER     = "cn=userinfo,ou=ldapaccess,dc=test,dc=ca"
    setenv LDAP_PASSWD   = "password1234"
    setenv LDAP_TACMEMBER = "URTI"
    exec = /usr/local/lib/mavis/mavis_tacplus-ng_ldap.pl
}

Also, can we change the authentication type from ascii to pap for LDAP?

**Comment by MarcJHuber** [comment]
Hi,

ok, thanks for clarifying. Now, when doing a LDAP search, what't the exact content of this "URTI" attribute? I've never seen this.

Regarding ASCII vs. PAP: both provide the password in clear text. What's the exact issue you're seeing? Please provide a full configuration that illustrates the problem.

Cheers,

Marc

**Comment by dgaur25** [comment]
Hi Marc,

URTI is a custom attribute that we have which stores a users information. E.g. if the user is an employee, URTI=EMP.Below is the sample ldapsearch:
root@tacasprd-01:/etc/tac_plus-ng# ldapsearch -x -H ldaps://testldapserver.ca -D "cn=userinfo,ou=ldapaccess,dc=test,dc=ca" -w "password1234" -b "ou=people,dc=test,dc=ca" "(uid=test_user)"


# test_user, people, test.ca
dn: uid=test_user,ou=people,dc=test,dc=ca
sn: User
uidNumber: 225511
mail: test_user@test.ca
uid: test_user
cn: Test User
homeDirectory: /afs/test.ca/home/t/u/test_user
accountType: Primary
ou: ais
displayName: Test
givenName: Test
employeeNumber: 1684148
sambaNTPassword: B329215EB0E76F581D15316A65C94811
gidNumber: 225511
uofaHasTamis: TRUE
uOfACurrentAlumni: TRUE
objectClass: posixAccount
objectClass: sambaSamAccount
objectClass: inetLocalMailRecipient
objectClass: InetOrgPerson
objectClass: TestClass

# tamis15456, test_user, people, test.ca
dn: role=tamis15456,uid=test_user,ou=people,dc=test,dc=ca
objectClass: InetOrgPerson
role: tamis15456
uid: test_user
sn: User
cn: Test User
givenName: Test
ou: Infrastructure Operations
displayName: Test
title: Network Specialist-Automation

# peoplesoft1, test_user, people, test.ca
dn: role=peoplesoft1,uid=test_user,ou=people,dc=test,dc=ca
employeeType: employee
**URTI: EMP**
uid: test_user
departmentNumber: 54221
sn: User
cn: Test User
givenName: Test



Also, this ldapsearch passes, but when I use the LDAP user/password in tac+ng config, I am not able to login to the device. The user lookup succeeds.
With anonymous bind, I can login successfully.  
Below are the logs:

New tacacs session
1134243: 19:20:21.672 0/306ea827: 10.1.1.1 ---<start packet>---
1134243: 19:20:21.672 0/306ea827: 10.1.1.1 key used: test_key1232
1134243: 19:20:21.672 0/306ea827: 10.1.1.1 version: 192, type: 1, seq no: 1, flags: unencrypted
1134243: 19:20:21.672 0/306ea827: 10.1.1.1 session id: 306ea827, data length: 30
1134243: 19:20:21.672 0/306ea827: 10.1.1.1 packet body (len: 30):
1134243: 19:20:21.672 0/306ea827: 10.1.1.1 0000 01 01 01 01 05 04 0d 00  64 67 61 75 72 74 74 79  ........ test_usertty
1134243: 19:20:21.672 0/306ea827: 10.1.1.1 0010 32 31 34 32 2e 32 34 34  2e 30 2e 32 31 33        212.1.1.1
1134243: 19:20:21.672 0/306ea827: 10.1.1.1 AUTHEN/START, priv_lvl=1
1134243: 19:20:21.672 0/306ea827: 10.1.1.1 action=login (1)
1134243: 19:20:21.672 0/306ea827: 10.1.1.1 authen_type=ascii (1)
1134243: 19:20:21.672 0/306ea827: 10.1.1.1 service=login (1)
1134243: 19:20:21.672 0/306ea827: 10.1.1.1 user_len=5 port_len=4 rem_addr_len=13
1134243: 19:20:21.672 0/306ea827: 10.1.1.1 data_len=0
1134243: 19:20:21.672 0/306ea827: 10.1.1.1 user (len: 5): test_user
1134243: 19:20:21.672 0/306ea827: 10.1.1.1 port (len: 4): tty2
1134243: 19:20:21.672 0/306ea827: 10.1.1.1 rem_addr (len: 13): 12.2.2.2
1134243: 19:20:21.672 0/306ea827: 10.1.1.1 ---<end packet>---
1134243: 19:20:21.672 0/306ea827: 10.1.1.1 authen: hdr->seq_no: 1
1134243: 19:20:21.672 0/306ea827: 10.1.1.1 looking for user test_user realm default
1134243: 19:20:21.672 0/306ea827: 10.1.1.1 user lookup succeded
1134243: 19:20:21.672 0/306ea827: 10.1.1.1 Writing AUTHEN/GETPASS size=54
1134243: 19:20:21.672 0/306ea827: 10.1.1.1 ---<start packet>---
1134243: 19:20:21.672 0/306ea827: 10.1.1.1 key used: test_key1232
1134243: 19:20:21.672 0/306ea827: 10.1.1.1 version: 192, type: 1, seq no: 2, flags: unencrypted
1134243: 19:20:21.672 0/306ea827: 10.1.1.1 session id: 306ea827, data length: 42
1134243: 19:20:21.672 0/306ea827: 10.1.1.1 packet body (len: 42):
1134243: 19:20:21.672 0/306ea827: 10.1.1.1 0000 05 01 00 24 00 00 55 73  65 72 20 41 63 63 65 73  ...$..Us er Acces
1134243: 19:20:21.672 0/306ea827: 10.1.1.1 0010 73 20 56 65 72 69 66 69  63 61 74 69 6f 6e 0a 0a  s Verifi cation..
1134243: 19:20:21.672 0/306ea827: 10.1.1.1 0020 50 61 73 73 77 6f 72 64  3a 20                    Password : 
1134243: 19:20:21.672 0/306ea827: 10.1.1.1 AUTHEN, status=5 (AUTHEN/GETPASS) flags=0x1
1134243: 19:20:21.672 0/306ea827: 10.1.1.1 msg_len=36, data_len=0
1134243: 19:20:21.672 0/306ea827: 10.1.1.1 msg (len: 36): User Access Verification\n\nPassword: 
1134243: 19:20:21.672 0/306ea827: 10.1.1.1 data (len: 0): 
1134243: 19:20:21.672 0/306ea827: 10.1.1.1 ---<end packet>---
1134243: 19:20:30.492 0/306ea827: 10.1.1.1 ---<start packet>---
1134243: 19:20:30.492 0/306ea827: 10.1.1.1 key used: test_key1232
1134243: 19:20:30.492 0/306ea827: 10.1.1.1 version: 192, type: 1, seq no: 3, flags: unencrypted
1134243: 19:20:30.492 0/306ea827: 10.1.1.1 session id: 306ea827, data length: 17
1134243: 19:20:30.492 0/306ea827: 10.1.1.1 packet body [partially masked] (len: 12):
1134243: 19:20:30.492 0/306ea827: 10.1.1.1 0000 00 0c 00 00 00 2a 2a 2a  2a 2a 2a 2a 2a 2a 2a 2a  .....*** ********
1134243: 19:20:30.492 0/306ea827: 10.1.1.1 0010 2a                                                *
1134243: 19:20:30.492 0/306ea827: 10.1.1.1 AUTHEN/CONT user_msg_len=12, user_data_len=0
1134243: 19:20:30.492 0/306ea827: 10.1.1.1 ---<end packet>---
1134243: 19:20:30.492 0/306ea827: 10.1.1.1 authen: hdr->seq_no: 3
1134243: 19:20:30.492 0/306ea827: 10.1.1.1 looking for user test_user realm default
1134243: 19:20:30.492 0/306ea827: 10.1.1.1 user lookup succeded
1134243: 19:20:30.492 0/306ea827: 10.1.1.1 evaluating ACL __internal__username_acl__
1134243: 19:20:30.492 0/306ea827: 10.1.1.1  regex: '[]<>/()|=[*"':$]+' <=> 'test_user' = 0
1134243: 19:20:30.492 0/306ea827: 10.1.1.1  line 509: [user] regex '[]<>/()|=[*"':$]+' => false
1134243: 19:20:30.492 0/306ea827: 10.1.1.1  line 509: [permit]
1134243: 19:20:30.492 0/306ea827: 10.1.1.1 ACL __internal__username_acl__: match
1134243: 19:20:30.492 0/306ea827: 10.1.1.1 looking for user test_user in MAVIS backend
1134243: 19:20:37.503 1/3b723b17: 10.1.1.1 New tacacs session
1134243: 19:20:37.503 1/3b723b17: 10.1.1.1 ---<start packet>---
1134243: 19:20:37.503 1/3b723b17: 10.1.1.1 key used: test_key1232
1134243: 19:20:37.503 1/3b723b17: 10.1.1.1 version: 192, type: 1, seq no: 1, flags: unencrypted
1134243: 19:20:37.503 1/3b723b17: 10.1.1.1 session id: 3b723b17, data length: 30
1134243: 19:20:37.503 1/3b723b17: 10.1.1.1 packet body (len: 30):
1134243: 19:20:37.503 1/3b723b17: 10.1.1.1 0000 01 01 01 01 05 04 0d 00  64 67 61 75 72 74 74 79  ........ test_usertty
1134243: 19:20:37.503 1/3b723b17: 10.1.1.1 0010 32 31 34 32 2e 32 34 34  2e 30 2e 32 31 33        212.1.1.1
1134243: 19:20:37.503 1/3b723b17: 10.1.1.1 AUTHEN/START, priv_lvl=1
1134243: 19:20:37.503 1/3b723b17: 10.1.1.1 action=login (1)
1134243: 19:20:37.503 1/3b723b17: 10.1.1.1 authen_type=ascii (1)
1134243: 19:20:37.503 1/3b723b17: 10.1.1.1 service=login (1)
1134243: 19:20:37.503 1/3b723b17: 10.1.1.1 user_len=5 port_len=4 rem_addr_len=13
1134243: 19:20:37.503 1/3b723b17: 10.1.1.1 data_len=0
1134243: 19:20:37.503 1/3b723b17: 10.1.1.1 user (len: 5): test_user
1134243: 19:20:37.503 1/3b723b17: 10.1.1.1 port (len: 4): tty2
1134243: 19:20:37.503 1/3b723b17: 10.1.1.1 rem_addr (len: 13): 12.2.2.2
1134243: 19:20:37.503 1/3b723b17: 10.1.1.1 ---<end packet>---
1134243: 19:20:37.503 1/3b723b17: 10.1.1.1 authen: hdr->seq_no: 1
1134243: 19:20:37.503 1/3b723b17: 10.1.1.1 looking for user test_user realm default
1134243: 19:20:37.503 1/3b723b17: 10.1.1.1 user lookup succeded
1134243: 19:20:37.503 1/3b723b17: 10.1.1.1 Writing AUTHEN/GETPASS size=54
1134243: 19:20:37.503 1/3b723b17: 10.1.1.1 ---<start packet>---
1134243: 19:20:37.503 1/3b723b17: 10.1.1.1 key used: test_key1232
1134243: 19:20:37.503 1/3b723b17: 10.1.1.1 version: 192, type: 1, seq no: 2, flags: unencrypted
1134243: 19:20:37.503 1/3b723b17: 10.1.1.1 session id: 3b723b17, data length: 42
1134243: 19:20:37.503 1/3b723b17: 10.1.1.1 packet body (len: 42):
1134243: 19:20:37.503 1/3b723b17: 10.1.1.1 0000 05 01 00 24 00 00 55 73  65 72 20 41 63 63 65 73  ...$..Us er Acces
1134243: 19:20:37.503 1/3b723b17: 10.1.1.1 0010 73 20 56 65 72 69 66 69  63 61 74 69 6f 6e 0a 0a  s Verifi cation..
1134243: 19:20:37.503 1/3b723b17: 10.1.1.1 0020 50 61 73 73 77 6f 72 64  3a 20                    Password : 
1134243: 19:20:37.503 1/3b723b17: 10.1.1.1 AUTHEN, status=5 (AUTHEN/GETPASS) flags=0x1
1134243: 19:20:37.503 1/3b723b17: 10.1.1.1 msg_len=36, data_len=0
1134243: 19:20:37.503 1/3b723b17: 10.1.1.1 msg (len: 36): User Access Verification\n\nPassword: 
1134243: 19:20:37.503 1/3b723b17: 10.1.1.1 data (len: 0): 
1134243: 19:20:37.503 1/3b723b17: 10.1.1.1 ---<end packet>---

**Comment by dgaur25** [comment]
I checked with the LDAP team and they confirmed that the bind is successful with the username and password.

**Comment by MarcJHuber** [comment]
Hi,

> 1134243: 19:20:30.492 0/306ea827: 10.1.1.1 looking for user test_user in MAVIS backend
> 1134243: 19:20:37.503 1/3b723b17: 10.1.1.1 New tacacs session

the backend script doesn't respond for 7 seconds, and the device starts a new query. You can check this by setting the LDAP_* environment variables and feeding it a test string, e.g.:

```
printf "0 TACPLUS\n4 $USER\n8 $PASS\n49 AUTH\n=\n" |  env LDAP_HOSTS="ldaps://testldapserver.ca" "LDAP_...=..." ...  /usr/local/lib/mavis/mavis_tacplus-ng_ldap.pl
```

Cheers,

Marc

**Comment by dgaur25** [comment]
I ran the test command and getting a response from LDAP server:

root@tacasprd-01:/etc/tac_plus-ng# printf "0 TACPLUS\n4 test_user\n8 testing1234\n49 AUTH\n=\n" |  env LDAP_HOSTS="ldaps://testldapserver.ca" env LDAP_BASE="ou=people,dc=test,dc=ca" env LDAP_USER="cn=userinfo,ou=ldapaccess,dc=test,dc=ca" env LDAP_PASSWD="password1234" env LDAP_FILTER="(&(objectClass=posixAccount)(uid=%s))" /usr/local/lib/mavis/mavis_tacplus-ng_ldap.pl
0 TACPLUS
1 "cn=ist-core,ou=ise,ou=app,ou=groups,dc=test,dc=ca","cn=ist-test,ou=ise,ou=app,ou=groups,dc=test,dc=ca"
4 test_user
5 uid=test_user,ou=people,dc=test,dc=ca
6 ACK
8 testing1234
9 330853
10 330853
19 /afs/test.ca/home/t/u/test_user
24 330853
47 "ist-core","ist-test"
49 AUTH
52 1
=0

**Comment by MarcJHuber** [comment]
Hi,

ok, so the backend works fine. If this is a docker setup this issue might duplicate #248. If not, please reconfigure with `--debug` and run the daemon with `-d -2`. That debug output might give more data (e.g. show that `mavis_cancel` is being called).

Cheers,

Marc

**Comment by dgaur25** [comment]
Hi Marc, I did a configure with --debug and then ran the daemon ( tac_plus-ng -d 2 /etc/tac_plus-ng/tac_plus-ng.cfg ) while logging in to the device and no results. The terminal says nothing. I did an strace, attached is the output.

[strace.txt](https://github.com/user-attachments/files/31426854/strace.txt)

**Comment by MarcJHuber** [comment]
Hi,

please run the daemon with `tac_plus-ng -d -2 -1 -f /etc/tac_plus-ng/tac_plus-ng.cfg`, this will keep the daemon in the foreground and switch to single-process mode, and detailed debug output shows up on stderr.

Thans,

Marc

**Comment by dgaur25** [comment]
Below is the output after running the daemon:

tac_plus-ng -d -2 -1 -f /etc/tac_plus-ng/tac_plus-ng.cfg
3736620: io_init
3736620: + spawnd_bind_listener
3736620:  + io_sched_del
3736620:  - io_sched_del
3736620:   io_register 5
3736620: - spawnd_bind_listener
3736620: + spawnd_bind_listener
3736620:  + io_sched_del
3736620:  - io_sched_del
3736620:   io_register 6
3736620: - spawnd_bind_listener
3736620: + spawnd_bind_listener
3736620:  + io_sched_del
3736620:  - io_sched_del
3736620:   io_register 7
3736620: - spawnd_bind_listener


I killed the tac_plus-ng PID and still see this. Also while running tactrace, I'm getting this error:
./tactrace.pl --conf /etc/tac_plus-ng/tac_plus-ng.cfg

The server process prematurely closed the connection.

**Comment by MarcJHuber** [comment]
HI,

there might be another tac_plus-ng instance running on your system. You should stop that one and retry.

The debug output should then look quite a lot like the one you've posted in https://github.com/MarcJHuber/event-driven-servers/issues/250#issuecomment-5360740107  

Cheers,

Marc

**Comment by dgaur25** [comment]
It is weird because I don't have any process running. I killed every process but still the same:

root@tacasprd-01:~/event-driven-servers/tac_plus-ng/perl# ss -tulpn | grep -E '49|tac_plus'
root@tacasprd-01:~/event-driven-servers/tac_plus-ng/perl# pgrep -a tac
root@tacasprd-01:~/event-driven-servers/tac_plus-ng/perl# tac_plus-ng -d -2 -1 -f /etc/tac_plus-ng/tac_plus-ng.cfg
3818429: io_init
3818429: + spawnd_bind_listener
3818429:  + io_sched_del
3818429:  - io_sched_del
3818429:   io_register 5
3818429: - spawnd_bind_listener
3818429: + spawnd_bind_listener
3818429:  + io_sched_del
3818429:  - io_sched_del
3818429:   io_register 6
3818429: - spawnd_bind_listener
3818429: + spawnd_bind_listener
3818429:  + io_sched_del
3818429:  - io_sched_del
3818429:   io_register 7
3818429: - spawnd_bind_listener

**Comment by MarcJHuber** [comment]
Hi,

I'm sorry, I think I'm lost. So, the debug output doesn't even show the TACACS+ request from your device? Any error messages on the router/switch/whatever?

Thanks,

Marc

**Comment by dgaur25** [comment]
Hi Marc, apologies for the confusion here. 
My debug output doesn't show anything even though no process is running.

root@isttacasprd-01:/home/dgaur# service tac_plus-ng status
○ tac_plus-ng.service - TACACS+ NG Server
     Loaded: loaded (/etc/systemd/system/tac_plus-ng.service; enabled; preset: enabled)
     Active: inactive (dead) since Tue 2026-08-25 20:19:25 UTC; 1 day 18h ago
   Duration: 16.501s
   Main PID: 3817917 (code=exited, status=0/SUCCESS)
        CPU: 571ms

Aug 25 20:19:08 tacasprd-01 tac_plus-ng[3817917]: bind to [0.0.0.0]:49 succeeded
Aug 25 20:19:08 tacasprd-01 tac_plus-ng[3817917]: bind to [0.0.0.0]:1812 succeeded
Aug 25 20:19:08 tacasprd-01 tac_plus-ng[3817917]: bind to [0.0.0.0]:1813 succeeded
Aug 25 20:19:08 tacasprd-01 tac_plus-ng[3817925]: epoll event notification mechanism is being used
Aug 25 20:19:08 tacasprd-01 tac_plus-ng[3817925]: - Version 7e9095102b822bf39c13f0350b2e2eb1f3e93521 initialized
Aug 25 20:19:25 tacasprd-01 tac_plus-ng[3817917]: SIGTERM: exiting
Aug 25 20:19:25 tacasprd-01 tac_plus-ng[3817925]: - Exiting.
Aug 25 20:19:25 tacasprd-01 systemd[1]: Stopping tac_plus-ng.service - TACACS+ NG Server...
Aug 25 20:19:25 tacasprd-01 systemd[1]: tac_plus-ng.service: Deactivated successfully.
Aug 25 20:19:25 tacasprd-01 systemd[1]: Stopped tac_plus-ng.service - TACACS+ NG Server.

root@isttacasprd-01:/home/dgaur# tac_plus-ng -d -2 -1 -f /etc/tac_plus-ng/tac_plus-ng.cfg
579481: io_init
579481: + spawnd_bind_listener
579481:  + io_sched_del
579481:  - io_sched_del
579481:   io_register 5
579481: - spawnd_bind_listener
579481: + spawnd_bind_listener
579481:  + io_sched_del
579481:  - io_sched_del
579481:   io_register 6
579481: - spawnd_bind_listener
579481: + spawnd_bind_listener
579481:  + io_sched_del
579481:  - io_sched_del
579481:   io_register 7
579481: - spawnd_bind_listener


Also, my ldap binding succeeds without username/password but fails with user/pass. The lookup however is successful. 

I am also not able to run tactrace:

root@tacasprd-01:~/event-driven-servers/tac_plus-ng/perl# ./tactrace.pl --conf /etc/tac_plus-ng/tac_plus-ng.cfg

The server process prematurely closed the connection.

**Comment by dgaur25** [comment]
I also confirmed with the identity team, this authentication with user/pass is successful and the creds have all the permissions we need. And they don't see failure on their side.

**Comment by MarcJHuber** [comment]
Hi,

please provide a complete and working sample configuration that lets me reproduce this issue. That `The server process prematurely closed the connection.` message indicates a configuration error.

Cheers,

Marc

**Comment by dgaur25** [comment]
[test_config.txt](https://github.com/user-attachments/files/31524624/test_config.txt)

Here is the config I'm using.

**Comment by MarcJHuber** [comment]
Hi,

you've configured `debug redirect = /var/log/tac_plus-ng/debug.log`, do your debug logs show up there?

Cheers,

Marc

**Comment by dgaur25** [comment]
Hi, 

Yes, they show up in the file. The ones I shared above:

New tacacs session
1134243: 19:20:21.672 0/306ea827: 10.1.1.1 ------
1134243: 19:20:21.672 0/306ea827: 10.1.1.1 key used: test_key1232
1134243: 19:20:21.672 0/306ea827: 10.1.1.1 version: 192, type: 1, seq no: 1, flags: unencrypted
1134243: 19:20:21.672 0/306ea827: 10.1.1.1 session id: 306ea827, data length: 30
1134243: 19:20:21.672 0/306ea827: 10.1.1.1 packet body (len: 30):
1134243: 19:20:21.672 0/306ea827: 10.1.1.1 0000 01 01 01 01 05 04 0d 00 64 67 61 75 72 74 74 79 ........ test_usertty
1134243: 19:20:21.672 0/306ea827: 10.1.1.1 0010 32 31 34 32 2e 32 34 34 2e 30 2e 32 31 33 212.1.1.1
1134243: 19:20:21.672 0/306ea827: 10.1.1.1 AUTHEN/START, priv_lvl=1
1134243: 19:20:21.672 0/306ea827: 10.1.1.1 action=login (1)
1134243: 19:20:21.672 0/306ea827: 10.1.1.1 authen_type=ascii (1)
1134243: 19:20:21.672 0/306ea827: 10.1.1.1 service=login (1)
1134243: 19:20:21.672 0/306ea827: 10.1.1.1 user_len=5 port_len=4 rem_addr_len=13
1134243: 19:20:21.672 0/306ea827: 10.1.1.1 data_len=0
1134243: 19:20:21.672 0/306ea827: 10.1.1.1 user (len: 5): test_user
1134243: 19:20:21.672 0/306ea827: 10.1.1.1 port (len: 4): tty2
1134243: 19:20:21.672 0/306ea827: 10.1.1.1 rem_addr (len: 13): 12.2.2.2
1134243: 19:20:21.672 0/306ea827: 10.1.1.1 ------
1134243: 19:20:21.672 0/306ea827: 10.1.1.1 authen: hdr->seq_no: 1
1134243: 19:20:21.672 0/306ea827: 10.1.1.1 looking for user test_user realm default
1134243: 19:20:21.672 0/306ea827: 10.1.1.1 user lookup succeded
1134243: 19:20:21.672 0/306ea827: 10.1.1.1 Writing AUTHEN/GETPASS size=54
1134243: 19:20:21.672 0/306ea827: 10.1.1.1 ------
1134243: 19:20:21.672 0/306ea827: 10.1.1.1 key used: test_key1232
1134243: 19:20:21.672 0/306ea827: 10.1.1.1 version: 192, type: 1, seq no: 2, flags: unencrypted
1134243: 19:20:21.672 0/306ea827: 10.1.1.1 session id: 306ea827, data length: 42
1134243: 19:20:21.672 0/306ea827: 10.1.1.1 packet body (len: 42):
1134243: 19:20:21.672 0/306ea827: 10.1.1.1 0000 05 01 00 24 00 00 55 73 65 72 20 41 63 63 65 73 ...$..Us er Acces
1134243: 19:20:21.672 0/306ea827: 10.1.1.1 0010 73 20 56 65 72 69 66 69 63 61 74 69 6f 6e 0a 0a s Verifi cation..
1134243: 19:20:21.672 0/306ea827: 10.1.1.1 0020 50 61 73 73 77 6f 72 64 3a 20 Password :
1134243: 19:20:21.672 0/306ea827: 10.1.1.1 AUTHEN, status=5 (AUTHEN/GETPASS) flags=0x1
1134243: 19:20:21.672 0/306ea827: 10.1.1.1 msg_len=36, data_len=0
1134243: 19:20:21.672 0/306ea827: 10.1.1.1 msg (len: 36): User Access Verification\n\nPassword:
1134243: 19:20:21.672 0/306ea827: 10.1.1.1 data (len: 0):
1134243: 19:20:21.672 0/306ea827: 10.1.1.1 ------
1134243: 19:20:30.492 0/306ea827: 10.1.1.1 ------
1134243: 19:20:30.492 0/306ea827: 10.1.1.1 key used: test_key1232
1134243: 19:20:30.492 0/306ea827: 10.1.1.1 version: 192, type: 1, seq no: 3, flags: unencrypted
1134243: 19:20:30.492 0/306ea827: 10.1.1.1 session id: 306ea827, data length: 17
1134243: 19:20:30.492 0/306ea827: 10.1.1.1 packet body [partially masked] (len: 12):
1134243: 19:20:30.492 0/306ea827: 10.1.1.1 0000 00 0c 00 00 00 2a 2a 2a 2a 2a 2a 2a 2a 2a 2a 2a .....*** ********
1134243: 19:20:30.492 0/306ea827: 10.1.1.1 0010 2a *
1134243: 19:20:30.492 0/306ea827: 10.1.1.1 AUTHEN/CONT user_msg_len=12, user_data_len=0
1134243: 19:20:30.492 0/306ea827: 10.1.1.1 ------
1134243: 19:20:30.492 0/306ea827: 10.1.1.1 authen: hdr->seq_no: 3
1134243: 19:20:30.492 0/306ea827: 10.1.1.1 looking for user test_user realm default
1134243: 19:20:30.492 0/306ea827: 10.1.1.1 user lookup succeded
1134243: 19:20:30.492 0/306ea827: 10.1.1.1 evaluating ACL internal__username_acl
1134243: 19:20:30.492 0/306ea827: 10.1.1.1 regex: '[]<>/()|=["':$]+' <=> 'test_user' = 0
1134243: 19:20:30.492 0/306ea827: 10.1.1.1 line 509: [user] regex '[]<>/()|=["':$]+' => false
1134243: 19:20:30.492 0/306ea827: 10.1.1.1 line 509: [permit]
1134243: 19:20:30.492 0/306ea827: 10.1.1.1 ACL internal__username_acl: match
1134243: 19:20:30.492 0/306ea827: 10.1.1.1 looking for user test_user in MAVIS backend
1134243: 19:20:37.503 1/3b723b17: 10.1.1.1 New tacacs session
1134243: 19:20:37.503 1/3b723b17: 10.1.1.1 ------
1134243: 19:20:37.503 1/3b723b17: 10.1.1.1 key used: test_key1232
1134243: 19:20:37.503 1/3b723b17: 10.1.1.1 version: 192, type: 1, seq no: 1, flags: unencrypted
1134243: 19:20:37.503 1/3b723b17: 10.1.1.1 session id: 3b723b17, data length: 30
1134243: 19:20:37.503 1/3b723b17: 10.1.1.1 packet body (len: 30):
1134243: 19:20:37.503 1/3b723b17: 10.1.1.1 0000 01 01 01 01 05 04 0d 00 64 67 61 75 72 74 74 79 ........ test_usertty
1134243: 19:20:37.503 1/3b723b17: 10.1.1.1 0010 32 31 34 32 2e 32 34 34 2e 30 2e 32 31 33 212.1.1.1
1134243: 19:20:37.503 1/3b723b17: 10.1.1.1 AUTHEN/START, priv_lvl=1
1134243: 19:20:37.503 1/3b723b17: 10.1.1.1 action=login (1)
1134243: 19:20:37.503 1/3b723b17: 10.1.1.1 authen_type=ascii (1)
1134243: 19:20:37.503 1/3b723b17: 10.1.1.1 service=login (1)
1134243: 19:20:37.503 1/3b723b17: 10.1.1.1 user_len=5 port_len=4 rem_addr_len=13
1134243: 19:20:37.503 1/3b723b17: 10.1.1.1 data_len=0
1134243: 19:20:37.503 1/3b723b17: 10.1.1.1 user (len: 5): test_user
1134243: 19:20:37.503 1/3b723b17: 10.1.1.1 port (len: 4): tty2
1134243: 19:20:37.503 1/3b723b17: 10.1.1.1 rem_addr (len: 13): 12.2.2.2
1134243: 19:20:37.503 1/3b723b17: 10.1.1.1 ------
1134243: 19:20:37.503 1/3b723b17: 10.1.1.1 authen: hdr->seq_no: 1
1134243: 19:20:37.503 1/3b723b17: 10.1.1.1 looking for user test_user realm default
1134243: 19:20:37.503 1/3b723b17: 10.1.1.1 user lookup succeded
1134243: 19:20:37.503 1/3b723b17: 10.1.1.1 Writing AUTHEN/GETPASS size=54
1134243: 19:20:37.503 1/3b723b17: 10.1.1.1 ------
1134243: 19:20:37.503 1/3b723b17: 10.1.1.1 key used: test_key1232
1134243: 19:20:37.503 1/3b723b17: 10.1.1.1 version: 192, type: 1, seq no: 2, flags: unencrypted
1134243: 19:20:37.503 1/3b723b17: 10.1.1.1 session id: 3b723b17, data length: 42
1134243: 19:20:37.503 1/3b723b17: 10.1.1.1 packet body (len: 42):
1134243: 19:20:37.503 1/3b723b17: 10.1.1.1 0000 05 01 00 24 00 00 55 73 65 72 20 41 63 63 65 73 ...$..Us er Acces
1134243: 19:20:37.503 1/3b723b17: 10.1.1.1 0010 73 20 56 65 72 69 66 69 63 61 74 69 6f 6e 0a 0a s Verifi cation..
1134243: 19:20:37.503 1/3b723b17: 10.1.1.1 0020 50 61 73 73 77 6f 72 64 3a 20 Password :
1134243: 19:20:37.503 1/3b723b17: 10.1.1.1 AUTHEN, status=5 (AUTHEN/GETPASS) flags=0x1
1134243: 19:20:37.503 1/3b723b17: 10.1.1.1 msg_len=36, data_len=0
1134243: 19:20:37.503 1/3b723b17: 10.1.1.1 msg (len: 36): User Access Verification\n\nPassword:
1134243: 19:20:37.503 1/3b723b17: 10.1.1.1 data (len: 0):
1134243: 19:20:37.503 1/3b723b17: 10.1.1.1 ------

**Comment by MarcJHuber** [comment]
Hi,

ok, then please remove that `debug redirect` to let tac_plus-ng output all debug messages to stderr. Then retry your test. This should show something usable in the
```
1134243: 19:20:30.492 0/306ea827: 10.1.1.1 looking for user test_user in MAVIS backend
1134243: 19:20:37.503 1/3b723b17: 10.1.1.1 New tacacs session
```
line scope.

Cheers,

Marc

**Comment by dgaur25** [comment]
Hi, thanks for your help!

I removed it and now I see debug logs

[logs.txt](https://github.com/user-attachments/files/31526256/logs.txt)

. PFA file.

**Comment by MarcJHuber** [comment]
Hi,

ok, thanks. There's
```
662591: + mavis_cancel
662591:  + external:Mavis_cancel
662591:  - external:Mavis_cancel = 0
662591: - mavis_cancel (0)
```
which happens in the cleanup path and indicates that your device (or whatever is in the path between your device and the server) is closing the connection. Please verify the connection status with a tcpdump capture.

Still sounds a lot like [#250 ](https://github.com/MarcJHuber/event-driven-servers/issues/250#issuecomment-5360740107)

Cheers,

Marc

**Comment by dgaur25** [comment]
Hi, 

I increased the tacacs timeout on the device itself and I could login. 
Isn't there another way because then I'd have to change it on every device. I was previously using radiator and this same timeout worked fine on all devices.

Can I user user/pass bind for a specific host and use anonymous bind for everything else?

**Comment by MarcJHuber** [comment]
Hi,

that's interesting. So, basically tac_plus-ng isn't fast enough, and the AUTHEN/GETPASS is arriving late?

Could you validate that with a packet capture, please?

Cheers,

Marc

**Comment by dgaur25** [comment]
Hi, 

When I use the default config, it takes about 6 seconds to authenticate. 
Aug 27 21:26:49 tacacs-01 tac_plus-ng[745334]: 0/164ca987: 10.1.1.1 result for user test_user is ACK [**5575** ms]

But when I set these parameters, I get the result within 2 seconds
Aug 27 21:25:57 tacacs-01 tac_plus-ng[744781]: 0/391ffc09: 10.1.1.1 result for user test_user is ACK [**2053** ms]
        setenv LDAP_SKIP_MEMBEROF = 1
        setenv LDAP_SKIP_POSIXGROUP = 1
        setenv LDAP_SKIP_GROUPOFNAMES = 1

[parameters set.txt](https://github.com/user-attachments/files/31532012/parameters.set.txt)
[default parameters.txt](https://github.com/user-attachments/files/31532011/default.parameters.txt)

Also, when I do an LDAP search, I get the results in a few milliseconds:
time ldapsearch -x -H ldaps://test.alberta.ca -D "cn=ldapuser,ou=ldapaccess,dc=ualberta,dc=ca" -w "dffvfdv" -b "ou=people,dc=alberta,dc=ca" "(uid=test_user)" memberOf
real    0m2.009s
user    0m0.018s
sys     0m0.011s


time ldapsearch -x -H ldaps://test.alberta.ca -D "cn=ldapuser,ou=ldapaccess,dc=ualberta,dc=ca" -w "dffvfdv" -b "ou=people,dc=alberta,dc=ca" "(uid=test_user)" 
real    0m0.126s
user    0m0.021s
sys     0m0.009s

Here is the tcpdump output, 12.2.2.2 is the TACACS server

WITH SKIP PARAMETERS

21:37:18.303348 eno5np0 In  IP 10.1.1.1.52323 > 12.2.2.2.49: Flags [S], seq 108861570, win 4128, options [mss 536], length 0
21:37:18.303350 bond0 In  IP 10.1.1.1.52323 > 12.2.2.2.49: Flags [S], seq 108861570, win 4128, options [mss 536], length 0
21:37:18.303399 bond0 Out IP 12.2.2.2.49 > 10.1.1.1.52323: Flags [S.], seq 3480101896, ack 108861571, win 64240, options [mss 1460], length 0
21:37:18.303404 eno5np0 Out IP 12.2.2.2.49 > 10.1.1.1.52323: Flags [S.], seq 3480101896, ack 108861571, win 64240, options [mss 1460], length 0
21:37:18.304618 eno5np0 In  IP 10.1.1.1.52323 > 12.2.2.2.49: Flags [.], ack 1, win 4128, length 0
21:37:18.304620 bond0 In  IP 10.1.1.1.52323 > 12.2.2.2.49: Flags [.], ack 1, win 4128, length 0
21:37:18.305296 eno5np0 In  IP 10.1.1.1.52323 > 12.2.2.2.49: Flags [.], seq 1:43, ack 1, win 4128, length 42
21:37:18.305297 bond0 In  IP 10.1.1.1.52323 > 12.2.2.2.49: Flags [.], seq 1:43, ack 1, win 4128, length 42
21:37:18.305326 bond0 Out IP 12.2.2.2.49 > 10.1.1.1.52323: Flags [.], ack 43, win 64198, length 0
21:37:18.305331 eno5np0 Out IP 12.2.2.2.49 > 10.1.1.1.52323: Flags [.], ack 43, win 64198, length 0
21:37:18.306195 bond0 Out IP 12.2.2.2.49 > 10.1.1.1.52323: Flags [P.], seq 1:55, ack 43, win 64198, length 54
21:37:18.306200 eno5np0 Out IP 12.2.2.2.49 > 10.1.1.1.52323: Flags [P.], seq 1:55, ack 43, win 64198, length 54
21:37:18.504257 eno5np0 In  IP 10.1.1.1.52323 > 12.2.2.2.49: Flags [.], ack 55, win 4074, length 0
21:37:18.504259 bond0 In  IP 10.1.1.1.52323 > 12.2.2.2.49: Flags [.], ack 55, win 4074, length 0
21:37:20.738823 eno5np0 In  IP 10.1.1.1.52323 > 12.2.2.2.49: Flags [.], seq 43:72, ack 55, win 4074, length 29
21:37:20.738825 bond0 In  IP 10.1.1.1.52323 > 12.2.2.2.49: Flags [.], seq 43:72, ack 55, win 4074, length 29
21:37:20.779326 bond0 Out IP 12.2.2.2.49 > 10.1.1.1.52323: Flags [.], ack 72, win 64169, length 0
21:37:20.779332 eno5np0 Out IP 12.2.2.2.49 > 10.1.1.1.52323: Flags [.], ack 72, win 64169, length 0
21:37:26.374547 bond0 Out IP 12.2.2.2.49 > 10.1.1.1.52323: Flags [P.], seq 55:73, ack 72, win 64169, length 18
21:37:26.374553 eno5np0 Out IP 12.2.2.2.49 > 10.1.1.1.52323: Flags [P.], seq 55:73, ack 72, win 64169, length 18
21:37:26.377249 eno5np0 In  IP 10.1.1.1.52323 > 12.2.2.2.49: Flags [FP.], seq 72, ack 73, win 4056, length 0
21:37:26.377251 bond0 In  IP 10.1.1.1.52323 > 12.2.2.2.49: Flags [FP.], seq 72, ack 73, win 4056, length 0
21:37:26.377446 bond0 Out IP 12.2.2.2.49 > 10.1.1.1.52323: Flags [F.], seq 73, ack 73, win 64168, length 0
21:37:26.377453 eno5np0 Out IP 12.2.2.2.49 > 10.1.1.1.52323: Flags [F.], seq 73, ack 73, win 64168, length 0


WITHOUT SKIP:
21:36:38.951426 eno6np1 In  IP 10.1.1.1.31018 > 12.2.2.2.49: Flags [S], seq 3342017060, win 4128, options [mss 536], length 0
21:36:38.951428 bond0 In  IP 10.1.1.1.31018 > 12.2.2.2.49: Flags [S], seq 3342017060, win 4128, options [mss 536], length 0
21:36:38.951478 bond0 Out IP 12.2.2.2.49 > 10.1.1.1.31018: Flags [S.], seq 2185730030, ack 3342017061, win 64240, options [mss 1460], length 0
21:36:38.951484 eno5np0 Out IP 12.2.2.2.49 > 10.1.1.1.31018: Flags [S.], seq 2185730030, ack 3342017061, win 64240, options [mss 1460], length 0
21:36:38.954775 eno6np1 In  IP 10.1.1.1.31018 > 12.2.2.2.49: Flags [.], ack 1, win 4128, length 0
21:36:38.954777 bond0 In  IP 10.1.1.1.31018 > 12.2.2.2.49: Flags [.], ack 1, win 4128, length 0
21:36:38.955278 eno6np1 In  IP 10.1.1.1.31018 > 12.2.2.2.49: Flags [.], seq 1:43, ack 1, win 4128, length 42
21:36:38.955280 bond0 In  IP 10.1.1.1.31018 > 12.2.2.2.49: Flags [.], seq 1:43, ack 1, win 4128, length 42
21:36:38.955319 bond0 Out IP 12.2.2.2.49 > 10.1.1.1.31018: Flags [.], ack 43, win 64198, length 0
21:36:38.955325 eno5np0 Out IP 12.2.2.2.49 > 10.1.1.1.31018: Flags [.], ack 43, win 64198, length 0
21:36:38.956050 bond0 Out IP 12.2.2.2.49 > 10.1.1.1.31018: Flags [P.], seq 1:55, ack 43, win 64198, length 54
21:36:38.956055 eno5np0 Out IP 12.2.2.2.49 > 10.1.1.1.31018: Flags [P.], seq 1:55, ack 43, win 64198, length 54
21:36:39.155602 eno6np1 In  IP 10.1.1.1.31018 > 12.2.2.2.49: Flags [.], ack 55, win 4074, length 0
21:36:39.155604 bond0 In  IP 10.1.1.1.31018 > 12.2.2.2.49: Flags [.], ack 55, win 4074, length 0
21:36:41.962287 eno6np1 In  IP 10.1.1.1.31018 > 12.2.2.2.49: Flags [.], seq 43:72, ack 55, win 4074, length 29
21:36:41.962289 bond0 In  IP 10.1.1.1.31018 > 12.2.2.2.49: Flags [.], seq 43:72, ack 55, win 4074, length 29
21:36:42.003320 bond0 Out IP 12.2.2.2.49 > 10.1.1.1.31018: Flags [.], ack 72, win 64169, length 0
21:36:42.003326 eno5np0 Out IP 12.2.2.2.49 > 10.1.1.1.31018: Flags [.], ack 72, win 64169, length 0
21:36:43.768290 bond0 Out IP 12.2.2.2.49 > 10.1.1.1.31018: Flags [P.], seq 55:73, ack 72, win 64169, length 18
21:36:43.768296 eno5np0 Out IP 12.2.2.2.49 > 10.1.1.1.31018: Flags [P.], seq 55:73, ack 72, win 64169, length 18

**Comment by MarcJHuber** [comment]
Hi,

thanks a lot for all the details!

Ok, given that your ldapsearch performs fast and your LDAP_SKIP_* variables are set it's a pretty good question why this is taking too much time.

Does the test from https://github.com/MarcJHuber/event-driven-servers/issues/250#issuecomment-5361318378 show that delay, too? If yes, that might give a chance to isolate the root cause, and adding a couple of `print STDERR` lines to the Perl script might show where delay occurs exactly.

Current behavior with the LDAP_SKIP_* variables set is
- open LDAP connection if it doesn't exist, and set some defaults based on the server type. This mainly involves the root DSE and could possibly moved out of the loop
- search for user
- bind with user dn, retrieve attributes

I think adding `use Time::HiRes qw(gettimeofday);` at the beginning of the file should should be sufficient for a couple of inserted `print STDERR gettimeofday() . "\n";` lines to work. Could you try this?

EDIT: Use `print STDERR __LINE__ . " " . gettimeofday() . "\n";` -- not showing the line number is pointless.

Thanks,

Marc

**Comment by MarcJHuber** [comment]
Hi,

da6712fcabf7f526849c3dae97d0331ecef713b7 implements writing some time info to stderr. Please set the LDAP_DEBUG_TIME environment variable to an arbitrary value and retry. This show clarify where the script spends too much time.

Cheers,

Marc

**Comment by dgaur25** [comment]
Hi Marc, 

Thanks for the information. I updated mavis_tacplus-ng_ldap.pl and have set the LDAP_DEBUG_TIME=2. Should I run the debug as usual? Or is there something I'm missing? I don't see anything in the logs. 
I do see that there's a 2 second delay when the user av pairs are sent and received.

[logs_with_debug_timer.txt](https://github.com/user-attachments/files/31650630/logs_with_debug_timer.txt)

**Comment by MarcJHuber** [comment]
Hi,

the stderr output from the script will be redirected to syslog. It might be easier to just run the "printf" test, with LDAP_DEBUG_TIME being set.

Cheers,

Marc

**Comment by dgaur25** [comment]
Hi,

These are the values I'm getting:
**With LDAP_SKIP options set:**
ldap init (396): 0.09297
ldap bind (410): 0.001295
ldap search (423): 1.805707
ldap expand groupOfNames (439): 6e-06
bind (521): 0.002288

**Without LDAP_SKIP**:
ldap init (396): 0.102325
ldap bind (410): 0.001648
ldap search (423): 1.822617
ldap expand memberOf (435): 3.665225
gidNumber (474): 0.00218
gidNumber (481): 0.002151
bind (521): 0.047057

**Comment by MarcJHuber** [comment]
Hi,

ok, thanks -- so the "ldap search" topic takes about 1,8 seconds, which is much too long. Any chance to use a more specific LDAP base or to set the LDAP scope to "one"? Also, does your LDAP server actually index the "uid" attribute? I think that could actually be the main issue for that delay.

Cheers,

Marc

**Comment by dgaur25** [comment]
Hi, 

I am not sure about how indexing is setup on the LDAP side. But I'm going to reach out to the team and discuss. Will try what they suggest and get back. Thanks for your help!
