### ISSUE TITLE
`tac_plus-ng` with `ldapmavis-mt` backend hangs but `tactrace.pl` runs just fine

### ISSUE THREAD

**Issue by BrunoBlanes** [MarcJHuber/event-driven-servers#248]
Both take in the same configuration file and packet, I made sure it was equal byte-by-byte, and yet the script works, but the executable hangs forever or aborts silently.

## tac_plus-ng output
```log
[root@tacacs /]# tac_plus-ng /etc/tac_plus-ng/tac_plus-ng.cfg
20090: 09:01:46.017 0/6b8b4567: New tacacs session
20090: 09:01:46.017 0/6b8b4567: ---<start packet>---
20090: 09:01:46.017 0/6b8b4567: key used: demo
20090: 09:01:46.017 0/6b8b4567: version: 193, type: 1, seq no: 1, flags: unencrypted
20090: 09:01:46.017 0/6b8b4567: session id: 6b8b4567, data length: 46
20090: 09:01:46.017 0/6b8b4567: packet body [partially masked] (len: 15):
20090: 09:01:46.017 0/6b8b4567: <redacted>
20090: 09:01:46.017 0/6b8b4567: <redacted>
20090: 09:01:46.017 0/6b8b4567: <redacted>
20090: 09:01:46.017 0/6b8b4567: AUTHEN/START, priv_lvl=0
20090: 09:01:46.017 0/6b8b4567: action=login (1)
20090: 09:01:46.017 0/6b8b4567: authen_type=pap (2)
20090: 09:01:46.017 0/6b8b4567: service=login (1)
20090: 09:01:46.017 0/6b8b4567: user_len=12 port_len=4 rem_addr_len=7
20090: 09:01:46.017 0/6b8b4567: data_len=15
20090: 09:01:46.017 0/6b8b4567: user (len: 12): test_user
20090: 09:01:46.017 0/6b8b4567: port (len: 4): mgmt
20090: 09:01:46.017 0/6b8b4567: rem_addr (len: 7): 0.0.0.0
20090: 09:01:46.017 0/6b8b4567: ---<end packet>---
20090: 09:01:46.017 0/6b8b4567: authen: hdr->seq_no: 1
20090: 09:01:46.017 0/6b8b4567: looking for user test_user realm default
20090: 09:01:46.017 0/6b8b4567: user lookup failed
20090: 09:01:46.017 0/6b8b4567: evaluating ACL __internal__username_acl__
20090: 09:01:46.017 0/6b8b4567:  regex: '[]<>/()|=[*"':$]+' <=> 'test_user' = 0
20090: 09:01:46.017 0/6b8b4567:  line 595: [user] regex '[]<>/()|=[*"':$]+' => false
20090: 09:01:46.017 0/6b8b4567:  line 595: [permit]
20090: 09:01:46.017 0/6b8b4567: ACL __internal__username_acl__: match
20090: 09:01:46.017 0/6b8b4567: looking for user test_user in MAVIS backend
```

## tactrace.pl output
```log
[root@tacacs /]# tactrace.pl --conf /etc/tac_plus-ng/tac_plus-ng.cfg --username test_user --port mgmt --key 'demo' --remote 0.0.0.0  --authentype pap --mode authc --password=<redacted>
Version: 59299e1fd41808531d6c1271dea8712d8d8ca160
127.0.0.1 ---<start packet>---
127.0.0.1 session id: 00000001, data length: 46
127.0.0.1 packet body [partially masked] (len: 15):
127.0.0.1 <redacted>
127.0.0.1 <redacted>
127.0.0.1 <redacted>
127.0.0.1 AUTHEN/START, priv_lvl=0
127.0.0.1 action=login (1)
127.0.0.1 authen_type=pap (2)
127.0.0.1 service=login (1)
127.0.0.1 user_len=12 port_len=4 rem_addr_len=7
127.0.0.1 data_len=15
127.0.0.1 user (len: 12): test_user
127.0.0.1 port (len: 4): mgmt
127.0.0.1 rem_addr (len: 7): 0.0.0.0
127.0.0.1 ---<end packet>---
127.0.0.1 authen: hdr->seq_no: 1
127.0.0.1 looking for user test_user realm default
127.0.0.1 user lookup failed
127.0.0.1 evaluating ACL __internal__username_acl__
127.0.0.1  regex: '[]<>/()|=[*"':$]+' <=> 'test_user' = 0
127.0.0.1  line 595: [user] regex '[]<>/()|=[*"':$]+' => false
127.0.0.1  line 595: [permit]
127.0.0.1 ACL __internal__username_acl__: match
127.0.0.1 looking for user test_user in MAVIS backend
127.0.0.1 >>> sent user av pairs:
127.0.0.1 USER (len: 12): test_user
127.0.0.1 SERVERIP (len: 9): 127.0.0.1
127.0.0.1 IPADDR (len: 7): 0.0.0.0
127.0.0.1 REALM (len: 7): default
127.0.0.1 <<< received user av pairs:
127.0.0.1 USER (len: 12): test_user
127.0.0.1 DN (len: 53): uid=test_user,ou=People,dc=example,dc=com
127.0.0.1 TACMEMBER (len: 15): "Administrator"
127.0.0.1 MEMBEROF (len: 64): "cn=Administrator,ou=Roles,dc=example,dc=com"
127.0.0.1 SERVERIP (len: 9): 127.0.0.1
127.0.0.1 IPADDR (len: 7): 0.0.0.0
127.0.0.1 REALM (len: 7): default
127.0.0.1 UID (len: 5): 10000
127.0.0.1 GID (len: 5): 10000
127.0.0.1 HOME (len: 1): /
127.0.0.1 SHELL (len: 9): /bin/bash
127.0.0.1 IDENTITY_SOURCE (len: 1): 0
127.0.0.1 result for user test_user is ACK [361 ms]
127.0.0.1 looking for user test_user realm default
127.0.0.1 user lookup succeded
127.0.0.1 evaluating ACL default#0
127.0.0.1  line 58: [member] member 'administrator' => true
127.0.0.1  line 59: [profile] 'administrator'
127.0.0.1  line 60: [permit]
127.0.0.1 ACL default#0: match
127.0.0.1 test_user@0.0.0.0: ACL default#0: permit (profile: administrator)
127.0.0.1 127.0.0.1: Possibly no single-connection support. Context feature may or may not work.
127.0.0.1 pap login for 'test_user' from 0.0.0.0 on mgmt succeeded (profile=administrator)
127.0.0.1 Writing AUTHEN/PASS size=18
127.0.0.1 ---<start packet>---
127.0.0.1 session id: 00000001, data length: 6
127.0.0.1 packet body (len: 6):
127.0.0.1 0000 01 00 00 00 00 00                                 ......
127.0.0.1 AUTHEN, status=1 (AUTHEN/PASS) flags=0x0
127.0.0.1 msg_len=0, data_len=0
127.0.0.1 msg (len: 0):
127.0.0.1 data (len: 0):
127.0.0.1 ---<end packet>---
- exit status=0
```

**Comment by MarcJHuber** [comment]
Hi Bruno,

that's ... unexpected, thanks for reporting. I'll need some time to investigate this one ... tactrace.pl us just feeding a packet into tac_plus-ng by bypassing the spawnd component, and behavior shouldn't differ, at all. I'll try to replicate this.

Cheers,

Marc

**Comment by BrunoBlanes** [comment]
Hi Marc,
That narrows down my issue, but I still don't know why it won't work with spawnd. Is it possible to spawn `tac_plus-ng` using Systemd Socket Activation? It seems to require the spawnd block.

**Comment by MarcJHuber** [comment]
Hi,

no, the spawnd component is mandatory,  so systemd mechanisms won't work.

Speaking of systemd, that's how you're starting tac_plus-ng?

Cheers,

Marc

**Comment by BrunoBlanes** [comment]
No, I haven't gotten there yet, I'm just starting it with the `tac_plus-ng` command line. I do, however, intent on starting it as a systemd service after internal testing is concluded, but for now I'm stuck.

**Comment by MarcJHuber** [comment]
Hi,

ok, starting from the shell is great for testing. I'd suggest to "./configure --debug tac_plus-ng; make; sudo make install" and then retry with `tac_plus-ng -d 2 -1 -f <path-to-your-config-file>`. This might show more than that `looking for user test_user in MAVIS backend` line.

Cheers,

Marc

**Comment by BrunoBlanes** [comment]
Just tried that with a fresh `git clone` and got the same results.

**Comment by MarcJHuber** [comment]
Hi,

looking at the code there's no way that "looking for user ... in MAVIS backend" could be the final message with full debugging enabled, unless the daemon crashes. Does it? Please retry ` strace -f tac_plus-ng -d 2 -1 -f <path-to-your-config-file>`.

Cheers,

Marc

**Comment by BrunoBlanes** [comment]
It seems to be getting the LDAP reply here.

```strace
[pid  5896] write(1, "Ma\0\1\0\0\18\0\0\0\0000 TACPLUS\n1 \"cn=Admi"..., 324 <unfinished ...>
[pid  5893] <... epoll_wait resumed>[{events=EPOLLIN, data={u32=8, u64=163515658431102984}}], 8192, 2001) = 1
[pid  5896] <... write resumed>)        = 324
[pid  5893] read(8, "Ma\0\1\0\0\18\0\0\0\0", 12) = 12
[pid  5896] rt_sigprocmask(SIG_BLOCK, ~[RT_1],  <unfinished ...>
[pid  5893] read(8, "0 TACPLUS\n1 \"cn=Administrator,ou"..., 312) = 312
[pid  5896] <... rt_sigprocmask resumed>NULL, 8) = 0
[pid  5896] madvise(0x7fb748d0b000, 8368128, MADV_DONTNEED <unfinished ...>
[pid  5893] epoll_wait(4,  <unfinished ...>
[pid  5896] <... madvise resumed>)      = 0
[pid  5896] exit(0)                     = ?
[pid  5896] +++ exited with 0 +++
[pid  5893] <... epoll_wait resumed>[], 8192, 1898) = 0
[pid  5893] rt_sigprocmask(SIG_UNBLOCK, ~[SEGV RTMIN RT_1], NULL, 8) = 0
[pid  5893] rt_sigprocmask(SIG_SETMASK, ~[SEGV RTMIN RT_1], NULL, 8) = 0
[pid  5893] wait4(-1, 0x7ffca82a99b4, WNOHANG, NULL) = 0
[pid  5893] epoll_wait(4, [], 8192, 2001) = 0
[...]
```

I could send the entire `strace` output from if you'd like.

**Comment by MarcJHuber** [comment]
Hi Bruno,

thanks ... to further narrow down this, could you please check whether this behavior is can be seen with "ldapmavis", too? Removing the "-mt" suffix should be sufficient for testing this. If the "external" module works, then it's quite clearly an issue with the "external-mt" module.

Thanks,

Marc

**Comment by BrunoBlanes** [comment]
I'm assuming you meant this:
```diff
- mavis module = external-mt {
+ mavis module = external {
    [...]
    exec = /usr/sbin/ldapmavis-mt
}
```

It had the same behaviour and a similar ending of the `strace`:
```strace
[pid  6038] write(1, "0 TACPLUS\n1 \"cn=Administrator,ou"..., 315) = 315
[pid  6037] <... epoll_wait resumed>[{events=EPOLLIN, data={u32=8, u64=130987912593408008}}], 8192, 914) = 1
[pid  6038] poll([{fd=0, events=POLLIN}], 1, -1 <unfinished ...>
[pid  6037] read(8, "0 TACPLUS\n1 \"cn=Administrator,ou"..., 66535) = 315
[pid  6037] epoll_ctl(4, EPOLL_CTL_MOD, 8, {events=0, data={u32=8, u64=130987912593408008}}) = 0
[pid  6037] epoll_wait(4, [], 8192, 666) = 0
[pid  6037] rt_sigprocmask(SIG_UNBLOCK, ~[SEGV RTMIN RT_1], NULL, 8) = 0
[pid  6037] rt_sigprocmask(SIG_SETMASK, ~[SEGV RTMIN RT_1], NULL, 8) = 0
[pid  6037] wait4(-1, 0x7ffdc2b4b2f4, WNOHANG, NULL) = 0
[pid  6037] epoll_wait(4, [], 8192, 2001) = 0
[...]
```

**Comment by BrunoBlanes** [comment]
I should note that at one point I did even go as far as trying with `mavis_tacplus-ng_ldap.pl` Perl script and also had the same outcome, though then I wasn't _really_ trying to debug.

I just ran it again with `strace`:
```strace
[pid  6142] write(1, "0 TACPLUS\n1 \"cn=Administrator,ou"..., 320 <unfinished ...>
[pid  6141] <... epoll_wait resumed>[{events=EPOLLIN, data={u32=8, u64=66547528954281992}}], 8192, 1649) = 1
[pid  6142] <... write resumed>)        = 320
[pid  6141] read(8,  <unfinished ...>
[pid  6142] read(0,  <unfinished ...>
[pid  6141] <... read resumed>"0 TACPLUS\n1 \"cn=Administrator,ou"..., 66535) = 320
[pid  6141] epoll_ctl(4, EPOLL_CTL_MOD, 8, {events=0, data={u32=8, u64=66547528954281992}}) = 0
[pid  6141] epoll_wait(4, [], 8192, 1068) = 0
[pid  6141] rt_sigprocmask(SIG_UNBLOCK, ~[SEGV RTMIN RT_1], NULL, 8) = 0
[pid  6141] rt_sigprocmask(SIG_SETMASK, ~[SEGV RTMIN RT_1], NULL, 8) = 0
[pid  6141] wait4(-1, 0x7ffe2ca9a614, WNOHANG, NULL) = 0
[pid  6141] epoll_wait(4, [], 8192, 2001) = 0
[...]
```

**Comment by MarcJHuber** [comment]
Hi,

ny bad, please retry with  `tac_plus-ng -d -2 -1 -f <path-to-your-config-file>` and/or  `strace -f tac_plus-ng -d -2 -1 -f <path-to-your-config-file>` ("2" limits output to config parsing, and "-2" is everything else).

Thanks,

Marc

**Comment by BrunoBlanes** [comment]
Hi Marc,
I've re-ran it with the `external` and `external-mt` modules and also with `mavis_tacplus-ng_ldap.pl` and all seem to quit at the same point:

```log
6857: 21:40:25.877 0/6b8b4567: looking for user test_user in MAVIS backend
  6857:  av_set(TYPE) = TACPLUS
  6857:  av_set(USER) = test_user
  6857:  av_set(TIMESTAMP) = 1732610923
  6857:  av_set(TACTYPE) = AUTH
  6857:  av_set(SERVERIP) = <redacted>
  6857:  av_set(IPADDR) = 0.0.0.0
  6857:  av_set(REALM) = default
  6857:  av_set(PASSWORD) = <redacted>
6857: 21:40:25.877 0/6b8b4567: >>> sent user av pairs:
6857: 21:40:25.877 0/6b8b4567: USER (len: 12): test_user
6857: 21:40:25.877 0/6b8b4567: SERVERIP (len: 12): <redacted>
6857: 21:40:25.877 0/6b8b4567: IPADDR (len: 7): 0.0.0.0
6857: 21:40:25.877 0/6b8b4567: REALM (len: 7): default
  6857: + mavis_send
  6857:   av_set(SERIAL) = Z3QQ8WNhrVoQAjw7C9yWlA=
  6857:  + external:Mavis_send
  6857:    av_get(TYPE) = TACPLUS
  6857:    av_get(SERIAL) = Z3QQ8WNhrVoQAjw7C9yWlA=
  6857:   starting query on child 0 (Z3QQ8WNhrVoQAjw7C9yWlA=)
  6857:    av_get(TYPE) = TACPLUS
  6857:    av_get(TIMESTAMP) = 1732610923
  6857:    av_get(USER) = test_user
  6857:    av_get(PASSWORD) = <redacted>
  6857:    av_get(IPADDR) = 0.0.0.0
  6857:    av_get(SERIAL) = Z3QQ8WNhrVoQAjw7C9yWlA=
  6857:    av_get(SERVERIP) = <redacted>
  6857:    av_get(REALM) = default
  6857:    av_get(TACTYPE) = AUTH
  6857:   + external:write_to_child
  6857:   - external:write_to_child
  6857:  - external:Mavis_send = 1
  6857: - mavis_send (1)
  6857: io_sched_exec (0x1628060)
  6857: poll_timeout = 1872ms
  6857: io_poll (0x1628060)
  6857: fd 6 ctx 0x16db140
  6857: fd 6 cb = 0x43be95
  6857: + io_sched_drop
  6857: - io_sched_drop
  6857:  io_unregister 6
  6857: + mavis_cancel
  6857:  + external:Mavis_cancel
  6857:  - external:Mavis_cancel = 0
  6857: - mavis_cancel (0)
  6857: io_sched_exec (0x1628060)
  6857: poll_timeout = 1872ms
  6857: io_poll (0x1628060)
  6857: fd 8 ctx 0x7f28d0611010
  6857: fd 8 cb = 0x7f28d063819c
  6857: + external:read_from_child
  6857:  /opt/tac_plus-ng/tac_plus-ng-20260729/mavis/libmavis_external.c:479 /usr/sbin/mavis_tacplus-ng_ldap.pl
  6857:   av_get(SERIAL) = Z3QQ8WNhrVoQAjw7C9yWlA=
  6857:  + av_clear
  6857:  - av_clear
  6857:   av_set(TYPE) = TACPLUS
  6857:   av_get(TYPE) = TACPLUS
  6857:   av_set(MEMBEROF) = "cn=Administrator,ou=Roles,dc=example,dc=com"
  6857:   av_get(MEMBEROF) = "cn=Administrator,ou=Roles,dc=example,dc=com"
  6857:   av_set(TIMESTAMP) = 1732610923
  6857:   av_get(TIMESTAMP) = 1732610923
  6857:   av_set(USER) = test_user
  6857:   av_get(USER) = test_user
  6857:   av_set(DN) = uid=test_user,ou=People,dc=example,dc=com
  6857:   av_get(DN) = uid=test_user,ou=People,dc=example,dc=com
  6857:   av_set(RESULT) = ACK
  6857:   av_get(RESULT) = ACK
  6857:   av_set(PASSWORD) = <redacted>
  6857:   av_get(PASSWORD) = <redacted>
  6857:   av_set(UID) = 10000
  6857:   av_get(UID) = 10000
  6857:   av_set(GID) = 10000
  6857:   av_get(GID) = 10000
  6857:   av_set(IPADDR) = 0.0.0.0
  6857:   av_get(IPADDR) = 0.0.0.0
  6857:   av_set(HOME) = /
  6857:   av_get(HOME) = /
  6857:   av_set(SERIAL) = Z3QQ8WNhrVoQAjw7C9yWlA=
  6857:   av_get(SERIAL) = Z3QQ8WNhrVoQAjw7C9yWlA=
  6857:   av_set(SERVERIP) = <redacted>
  6857:   av_get(SERVERIP) = <redacted>
  6857:   av_set(REALM) = default
  6857:   av_get(REALM) = default
  6857:   av_set(TACMEMBER) = "Administrator"
  6857:   av_get(TACMEMBER) = "Administrator"
  6857:   av_set(TACTYPE) = AUTH
  6857:   av_get(TACTYPE) = AUTH
  6857:   av_set(PASSWORD_ONESHOT) = 1
  6857:   av_get(PASSWORD_ONESHOT) = 1
  6857:   av_set(SHELL) = /bin/bash
  6857:   av_get(SHELL) = /bin/bash
  6857:   av_get(SERIAL) = Z3QQ8WNhrVoQAjw7C9yWlA=
  6857:   av_get(RESULT) = ACK
  6857:   av_set(IDENTITY_SOURCE) = 0
  6857: - external:read_from_child
  6857: io_sched_exec (0x1628060)
  6857: poll_timeout = 1464ms
  6857: io_poll (0x1628060)
  6857: io_sched_exec (0x1628060)
  6857:  executing ...
  6857: io_sched_renew_proc 0x1681840
  6857: to be fired at 6a6beefd:000b758a
  6857: ... done.
  6857:  rescheduled at 6a6beefd:000b758a (2s)
  6857: poll_timeout = 2001ms
  [...]
```

While `strace` did output a lot, the end wasn't that much different.
```log
[...]
[pid  6914] write(2, "  6914:   av_set(REALM) = defaul"..., 47  6914:   av_set(REALM) = default) = 47
[pid  6914] write(2, "  6914:   av_get(REALM) = defaul"..., 47  6914:   av_get(REALM) = default) = 47
[pid  6914] write(2, "  6914:   av_set(TACMEMBER) = \"A"..., 51  6914:   av_set(TACMEMBER) = "Administrator") = 51
[pid  6914] write(2, "  6914:   av_get(TACMEMBER) = \"A"..., 51  6914:   av_get(TACMEMBER) = "Administrator") = 51
[pid  6914] write(2, "  6914:   av_set(TACTYPE) = AUTH"..., 49  6914:   av_set(TACTYPE) = AUTH) = 49
[pid  6914] write(2, "  6914:   av_get(TACTYPE) = AUTH"..., 49  6914:   av_get(TACTYPE) = AUTH) = 49
[pid  6914] write(2, "  6914:   av_set(SHELL) = /bin/b"..., 47  6914:   av_set(SHELL) = /bin/bash) = 47
[pid  6914] write(2, "  6914:   av_get(SHELL) = /bin/b"..., 47  6914:   av_get(SHELL) = /bin/bash) = 47
[pid  6914] write(2, "  6914:   av_get(SERIAL) = Z3QQ8"..., 51  6914:   av_get(SERIAL) = Z3QQ8WNhrVoQAjw7C9yWlA=) = 51
[pid  6914] write(2, "  6914:   av_get(RESULT) = ACK  "..., 48  6914:   av_get(RESULT) = ACK) = 48
[pid  6914] write(2, "  6914:   av_set(IDENTITY_SOURCE"..., 57  6914:   av_set(IDENTITY_SOURCE) = 0) = 57
[pid  6914] write(2, "  6914: - external-mt:read_from_"..., 38  6914: - external-mt:read_from_child) = 38
[pid  6914] write(2, "  6914: io_sched_exec (0x1099060"..., 34  6914: io_sched_exec (0x1099060)) = 34
[pid  6914] write(2, "  6914: poll_timeout = 181ms\n", 29  6914: poll_timeout = 181ms) = 29
[pid  6914] write(2, "  6914: io_poll (0x1099060)\n", 28  6914: io_poll (0x1099060)) = 28
[pid  6914] epoll_wait(4, [], 8192, 181) = 0
[pid  6914] write(2, "  6914: io_sched_exec (0x1099060"..., 34  6914: io_sched_exec (0x1099060)) = 34
[pid  6914] write(2, "  6914:  executing ...\n", 23  6914:  executing ...) = 23
[pid  6914] write(2, "  6914: io_sched_renew_proc 0x10"..., 38  6914: io_sched_renew_proc 0x10f2790) = 38
[pid  6914] write(2, "  6914: to be fired at 6a6bf26b:"..., 41  6914: to be fired at 6a6bf26b:0002d785) = 41
[pid  6914] rt_sigprocmask(SIG_UNBLOCK, ~[SEGV RTMIN RT_1], NULL, 8) = 0
[pid  6914] rt_sigprocmask(SIG_SETMASK, ~[SEGV RTMIN RT_1], NULL, 8) = 0
[pid  6914] wait4(-1, 0x7ffe1adae154, WNOHANG, NULL) = 0
[pid  6914] write(2, "  6914: ... done.\n", 18  6914: ... done.) = 18
[pid  6914] write(2, "  6914:  rescheduled at 6a6bf26b"..., 47  6914:  rescheduled at 6a6bf26b:0002d785 (2s)) = 47
[pid  6914] write(2, "  6914: poll_timeout = 2001ms\n", 30  6914: poll_timeout = 2001ms) = 30
[...]
```

**Comment by MarcJHuber** [comment]
Hi Bruno,

thanks, this helps. I can see mavis_cancel() being called, this part of the cleanup process:

>  6857: + mavis_cancel
>  6857:  + external:Mavis_cancel
>  6857:  - external:Mavis_cancel = 0
>  6857: - mavis_cancel (0)

Can you please verify (e.g. using tcpdump) that the TCP connection is kept open?

Thanks,

Marc

**Comment by BrunoBlanes** [comment]
Not according to `strace`, it appears there's a connection reset.

```diff
[pid  6914] write(2, "  6914: - mavis_send (1)\n", 25  6914: - mavis_send (1)) = 25
[pid  6914] write(2, "  6914: io_sched_exec (0x1099060"..., 34  6914: io_sched_exec (0x1099060)) = 34
[pid  6914] write(2, "  6914: poll_timeout = 474ms\n", 29  6914: poll_timeout = 474ms) = 29
[pid  6914] write(2, "  6914: io_poll (0x1099060)\n", 28  6914: io_poll (0x1099060)) = 28
[pid  6914] epoll_ctl(4, EPOLL_CTL_MOD, 7, {events=EPOLLOUT, data={u32=7, u64=76170248562147335}}) = 0
[pid  6914] epoll_wait(4, [{events=EPOLLIN|EPOLLERR|EPOLLHUP, data={u32=6, u64=76170248562147334}}, {events=EPOLLOUT, data={u32=7, u64=76170248562147335}}], 8192, 474) = 2
[pid  6914] write(2, "  6914: fd 6 ctx 0x114dcc0\n", 27  6914: fd 6 ctx 0x114dcc0) = 27
[pid  6914] write(2, "  6914: fd 6 cb = 0x43be95\n", 27  6914: fd 6 cb = 0x43be95) = 27
! [pid  6914] recvfrom(6, 0x114dda9, 12, 0, NULL, NULL) = -1 ECONNRESET (Connection reset by peer)
[pid  6914] write(2, "  6914: + io_sched_drop\n", 24  6914: + io_sched_drop) = 24
[pid  6914] write(2, "  6914: - io_sched_drop\n", 24  6914: - io_sched_drop) = 24
[pid  6914] setsockopt(6, SOL_SOCKET, SO_LINGER, {l_onoff=1, l_linger=0}, 8) = 0
[pid  6914] write(2, "  6914:  io_unregister 6\n", 25  6914:  io_unregister 6) = 25
[pid  6914] epoll_ctl(4, EPOLL_CTL_DEL, 6, 0x7ffe1adadfc4) = 0[pid  6914] close(6)                    = 0
[pid  6914] write(2, "  6914: + mavis_cancel\n", 23  6914: + mavis_cancel) = 23
[pid  6914] write(2, "  6914:  + external-mt:Mavis_can"..., 36  6914:  + external-mt:Mavis_cancel) = 36
[pid  6914] write(2, "  6914:  - external-mt:Mavis_can"..., 40  6914:  - external-mt:Mavis_cancel = 0) = 40
[pid  6914] write(2, "  6914: - mavis_cancel (0)\n", 27  6914: - mavis_cancel (0)) = 27
[pid  6914] write(2, "  6914: fd 7 ctx 0x10f2c00\n", 27  6914: fd 7 ctx 0x10f2c00) = 27
[pid  6914] write(2, "  6914: fd 7 cb = 0x7f147ddccee8"..., 33  6914: fd 7 cb = 0x7f147ddccee8) = 33
[pid  6914] write(2, "  6914: + external-mt:write_to_c"..., 37  6914: + external-mt:write_to_child) = 37
```

Also confirmed by `tcpdump`:
```diff
tcpdump: listening on ens18, link-type EN10MB (Ethernet), snapshot length 262144 bytes
04:34:57.838051 IP (tos 0x0, ttl 62, id 38018, offset 0, flags [DF], proto TCP (6), length 60)
    client.56171 > server.tacacs: Flags [S], cksum 0x07f9 (correct), seq 2118683925, win 64106, options [mss 9158,sackOK,TS val 3506152182 ecr 0,nop,wscale 8], length 0
04:34:57.838160 IP (tos 0x0, ttl 64, id 0, offset 0, flags [DF], proto TCP (6), length 60)
    server.tacacs > client.56171: Flags [S.], cksum 0xccca (incorrect -> 0xc507), seq 3693818641, ack 2118683926, win 64022, options [mss 9158,sackOK,TS val 2437522094 ecr 3506152182,nop,wscale 7], length 0
04:34:57.839424 IP (tos 0x0, ttl 62, id 38019, offset 0, flags [DF], proto TCP (6), length 52)
    client.56171 > server.tacacs: Flags [.], cksum 0x0b00 (correct), seq 1, ack 1, win 251, options [nop,nop,TS val 3506152184 ecr 2437522094], length 0
04:34:57.840323 IP (tos 0x0, ttl 62, id 38020, offset 0, flags [DF], proto TCP (6), length 110)
    client.56171 > server.tacacs: Flags [P.], cksum 0x347a (correct), seq 1:59, ack 1, win 251, options [nop,nop,TS val 3506152185 ecr 2437522094], length 58
04:34:57.840353 IP (tos 0x0, ttl 64, id 59747, offset 0, flags [DF], proto TCP (6), length 52)
    server.tacacs > client.56171: Flags [.], cksum 0xccc2 (incorrect -> 0x09c9), seq 1, ack 59, win 500, options [nop,nop,TS val 2437522097 ecr 3506152185], length 0
! 04:34:57.841554 IP (tos 0x0, ttl 60, id 0, offset 0, flags [DF], proto TCP (6), length 40)
!    client.56171 > server.tacacs: Flags [R], cksum 0xfc0e (correct), seq 2118683984, win 0, length 0
04:34:58.048130 IP (tos 0x0, ttl 62, id 38021, offset 0, flags [DF], proto TCP (6), length 110)
    client.56171 > server.tacacs: Flags [P.], cksum 0x33aa (correct), seq 1:59, ack 1, win 251, options [nop,nop,TS val 3506152393 ecr 2437522094], length 58
04:34:58.048252 IP (tos 0x0, ttl 64, id 0, offset 0, flags [DF], proto TCP (6), length 40)
    server.tacacs > client.56171: Flags [R], cksum 0xf869 (correct), seq 3693818642, win 0, length 0
```

Client-side logs indicate a connection failure though, weirdly enough, its timeout is set at `5s` and it is giving up way earlier, hence why I hadn't bothered with this being a possibility:
```log
2026-07-31 04:32:36.561 : 1/1 : <Warn> %AAA-REMOTE_AUTHENTICATION_TIMEOUT : authenticator-app[18113] : User [test_user]: All Tacacs servers unavailable.
```

I've tested with two vendors and even got to complete login on a Huawei at one point, but 99% of the time it resets the connection before timeout. I've also tried increasing said timeout to 300 seconds.

**Comment by MarcJHuber** [comment]
Hi Bruno,

I don't know how your network looks like, but NG firewalls typically allow the first couple of bytes for traffic analysis before dropping a connection. I'd check on the client whether it actually sends that reset. If it does, then checking the packet capture in Wireshark might give some hint.

Cheers,

Marc

**Comment by BrunoBlanes** [comment]
Aaaaaaand it was NAT mismatch I overlooked... Thank you for your time and effort, I really appreciate it.

**Comment by MarcJHuber** [comment]
Hi Bruno,

great that this is resolved, and thanks for reporting back!

Cheers,

Marc
